user_input,retrieved_contexts,response,reference,faithfulness,answer_relevancy,context_precision,context_recall
¿Cuál es la latencia típica de conversión del AD4086 y su resolución de bits?,"['The operating mode of the AD4086 is controlled by the OPERAT-ING\\_MODES bits in the device configuration register (see the [De](#page-71-0)[vice Configuration Register](#page-71-0) section, Address (0x02)). [...] *Figure 42. [...] 0 | 24 of 91**', 'ectly, the raw ADC conversion results. [...] *Figure 50. [...] *Figure 51. [...] All serial transactions between the system host and the AD4086 configuration registers are executed using the configuration SPI. [...] Each serial transaction consists of at least one instruction phase during which the desired memory operation, that is, read or write, and the starting address for the transaction are transmitted to the AD4086. [...] The instruction phase is immediately followed by a data transaction phase during which one or more bytes of information is exchanged between the host and the AD4086.', 'To minimize these challenges for the end user, the AD4086 has integrated both gain and offset correction on a per sample basis. [...] This equation can be applied to the ADC transfer function where: *y* is the corrected ADC result. [...] *x* is the uncorrected ADC result.', '*Figure 78. [...] 0 | 52 of 91** [...] The threshold detection of the AD4086 includes a hysteresis setting. [...] *Figure 79.', 'The features of the AD4086 family have been designed to simplify the application of low latency data capture to a broad array of measurement applications.', 'In this specific condition, it is still possible to write to the AD4086 SPI configuration to issue a command to return to normal mode by writing to the OPERATING\\_MODES bits in the device configuration register (see the [Device Configuration Register](#page-71-0) section) or to issue a software reset (see the [Software Reset](#page-25-0) section).']",INFORMACIÓN NO DISPONIBLE EN EL CORPUS DE SEGURIDAD,El AD4086 ofrece una resolución de 14 bits con una latencia típica de conversión de 48.21 ns.,1.0,0.0,0.0,0.0
¿Cuál es el consumo de potencia típico del AD4086 cuando funciona a una velocidad de muestreo de 40 MSPS?,"['The AD4086 integrates a charge reservoir capacitor (CREF) and a low-drift reference buffer at the reference input pin (REFIN), eliminating the need for dedicated external components and enabling multiple AD4086 devices to share a single voltage reference. [...] The AD4086 internally generates a common-mode reference voltage of one-half of VREFIN that is output through the CMO pin.', 'The AD4086 is a high speed, low noise, low distortion, 14-bit, Easy Drive, SAR ADC. [...] Innovations in the AD4086 product design enable both complexity reduction and component flexibility in the design of data acquisition signal chains.', 'The AD4086 includes all critical bypass capacitors within the device package, which greatly reduces the layout challenge for a precision, high-speed converter. [...] - ► The AD4086 contains internal decoupling on all power supplies, AVDD33 (0.47μF), VDD11 (1.88μF), IOVDD (0.22μF), as well as VDDLDO (0.22μF). [...] - ► Have a solid ground plane under the AD4086 and connect all analog ground (GND) pins, reference ground (REFGND), and digital ground (IOGND) pins to this shared plane.', 'AD4086 Functional Block Diagram* [...] The AD4086 is a high speed, low noise, low distortion, 14-bit, Easy Drive, successive approximation register (SAR) analog-to-digital converter (ADC). [...] Maintaining high performance (signal-to-noise and distortion (SINAD) ratio > 90dBFS) at signal frequencies in excess of 1MHz enables the AD4086 to service a wide variety of precision, wide bandwidth data acquisition applications. [...] The AD4086 Easy Drive features reduce both signal chain complexity and power consumption while enabling greater channel density and flexibility in companion component selection.', 'With such low noise and up to a 40MHz sampling rate, it is important that careful consideration is taken for the power solution of applications to ensure that the low noise supplies provided to the AD4086 do not become a source of performance or accuracy degradation. [...] To aid ease of use and to help reduce external required components, two internal LDO regulators are integrated within the AD4086.']",INFORMACIÓN NO DISPONIBLE EN EL CORPUS DE SEGURIDAD,El consumo de potencia típico del AD4086 es de 85 mW operando a una velocidad de 40 MSPS.,1.0,0.0,0.0,0.0
¿Cuál es la profundidad de muestra (sample depth) del FIFO de resultados de conversión integrado en el AD4086?,"['ectly, the raw ADC conversion results. [...] - ► Read up to 16k unfiltered results from the FIFO. [...] - ► Read up to 16k digitally filtered results from the FIFO. [...] *Figure 50. [...] - ► Read up to 16k unfiltered results from the FIFO. [...] - ► Read up to 16k digitally filtered results from the FIFO.', 'In this mode, the FIFO stores the results of the most recent FIFO\\_WATERMARK samples and then automatically disables capture into the memory. [...] When the FIFO is enabled, each conversion result is loaded into the internal memory on the rising edge of the convert start signal, CNV. [...] Internal timing dictates that FIFO\\_WATERMARK + three conversion clocks are required to write FIFO\\_WATERMARK sample results into the FIFO memory. [...] The Figure 81 timing diagram shows an example where FIFO\\_WA-TERMARK is set to 1000, and the first ADC results after the event occurred is captured by the FIFO after the third CNV. [...] After N = 1000, that is, it has reached the FIFO\\_WATERMARK value, FIFO\\_FULL is asserted, and data stops being captured into the FIFO. [...] Access to the FIFO data is made through either a LVDS configuration (single lane only) or the multi-output SPI configuration of the data interface after the capture has completed.', 'An internally or externally generated event can also be used to trigger the integrated result FIFO (see the [Result FIFO](#page-52-0) section). [...] The mechanism for this is explained in the [Event Detection for FIFO](#page-52-0) section. [...] *Figure 77.', 'igned. [...] When configured, this interface is used to access conversion results stored in the on-chip FIFO. [...] FIFO operation is explained in the [Result FIFO](#page-52-0) section.', '| FIFO is not used. [...] | Continuous convert mode, and FIFO is not in use. [...] | [...] | 01                     | Immediate trigger mode                          | In this mode, the data capture is initiated immediately after<br>receipt of the first valid converter result and continues until [N =<br>WATERMARK] results are loaded into the FIFO memory.<br>Upon read back from the FIFO, FIFO_READ_DONE indicates<br>when [N = WATERMARK] results are read from the FIFO.', '- ► Throughput: 40MSPS, 48.21ns conversion latency [...] - ► Dynamic range: 85.85dBFS [...] - ► Conversion result FIFO, 16K sample depth']",La profundidad de muestra (sample depth) del FIFO de resultados de conversión integrado en el AD4086 es de 16K [AD4086_Datasheet.pdf] [ID: P-5dadda8e].,El FIFO de resultados de conversión integrado posee una profundidad de 16K muestras.,0.0,1.0,0.6666666666333333,1.0
¿Cuáles son las especificaciones típicas de INL y DNL para el AD4086?,"['The AD4086 integrates a charge reservoir capacitor (CREF) and a low-drift reference buffer at the reference input pin (REFIN), eliminating the need for dedicated external components and enabling multiple AD4086 devices to share a single voltage reference. [...] *Figure 35. [...] The AD4086 internally generates a common-mode reference voltage of one-half of VREFIN that is output through the CMO pin. [...] The absolute error', 'The AD4086 is a high speed, low noise, low distortion, 14-bit, Easy Drive, SAR ADC. [...] Innovations in the AD4086 product design enable both complexity reduction and component flexibility in the design of data acquisition signal chains.', 'The AD4086 includes all critical bypass capacitors within the device package, which greatly reduces the layout challenge for a precision, high-speed converter. [...] - ► The AD4086 contains internal decoupling on all power supplies, AVDD33 (0.47μF), VDD11 (1.88μF), IOVDD (0.22μF), as well as VDDLDO (0.22μF). [...] - ► Have a solid ground plane under the AD4086 and connect all analog ground (GND) pins, reference ground (REFGND), and digital ground (IOGND) pins to this shared plane.', '# **OVERVIEW** [...] The AD4086 digital interface consists of a 4-wire SPI for device configuration, four general-purpose input and output (GPIO) pins, a conversion data access interface with selectable output format (LVDS or SPI data interface), and a conversion start input (CNV+ and CNV−) that can be configured for LVDS or CMOS level signaling.', 'AD4086 Functional Block Diagram* [...] The AD4086 is a high speed, low noise, low distortion, 14-bit, Easy Drive, successive approximation register (SAR) analog-to-digital converter (ADC). [...] Maintaining high performance (signal-to-noise and distortion (SINAD) ratio > 90dBFS) at signal frequencies in excess of 1MHz enables the AD4086 to service a wide variety of precision, wide bandwidth data acquisition applications. [...] Simplification of the input anti-alias filter design can be accomplished by applying oversampling along with the integrated digital filtering and decimation to reduce noise and lower the output data rate for applications that do not require the lowest latency of the AD4086. [...] The AD4086 Easy Drive features reduce both signal chain complexity and power consumption while enabling greater channel density and flexibility in companion component selection.']",INFORMACIÓN NO DISPONIBLE EN EL CORPUS DE SEGURIDAD,El INL típico del AD4086 es de ±12 ppm y el DNL típico es de ±0.063 LSB.,1.0,0.0,0.0,0.0
¿Qué funcionalidad tienen los pines B4 y B5 en el AD4086 y qué tipo de señal manejan?,"['| B4, B5                          | DCO−, DCO+ | DO    | LVDS Echo Clock Outputs. [...] | B6                              | IOGND', 'As described in the [Easy Drive Analog Inputs](#page-18-0) section, the AD4086 has a number of unique features that open this ADC up to being used with a wide range of driver amplifier solutions. [...] Because the AD4086 offers exceptionally low noise and excellent levels of precision at sampling rates up to 40MSPS with remarkably efficient power consumption, signal chain choices on which application parameters to prioritize is presented.', 'Each serial transaction consists of at least one instruction phase during which the desired memory operation, that is, read or write, and the starting address for the transaction are transmitted to the AD4086.', '### **POWER SAVING OPERATING MODES**\n\nThe operating mode of the AD4086 is controlled by the OPERAT-ING\\_MODES bits in the device configuration register (see the [De](#page-71-0)[vice Configuration Register](#page-71-0) section, Address (0x02)). On power-up and after reset, the default is normal mode (OPERATING\\_MODES = 00). [Table 11](#page-24-0) describes all operating modes, and Figure 42 depicts the allowed transitions between these modes. Note that direct transitions between the two power saving modes (standby mode and sleep mode) are not permitted.\n\nIt is important to stop all conversion and data interface clocking before configuring the power mode.\n\nWhen in either standby mode or sleep mode, the VDD33 supply can be removed to reduce power consumption. This supply must be re-established prior to issuing the SPI configuration interface command to exit either power saving mode.\n\n![](_page_23_Picture_11.jpeg)\n\n*Figure 42. Operating Mode Transitions*\n\nTransitioning from normal mode to either of the two power saving modes is achieved by writing the required value to the OPERAT-ING\\_MODES bits in the device configuration register (see the [Device Configuration Register](#page-71-0) section). Waking up (that is, transi-\n\n**[analog.com](http://www.analog.com/en/index.html) Rev. 0 | 24 of 91**', '# **SYSTEM ERROR CORRECTION COEFFICIENTS**\n\nSystematic gain and offset errors exist in all practical data acquisition circuits, and thus, the need for correction is essential to maximize the precision of the measurement channel. While these quantities can be corrected for in the host processor, implementation can be inefficient and consume more power than if integrated within the data converter. To minimize these challenges for the end user, the AD4086 has integrated both gain and offset correction on a per sample basis.\n\nTo describe the available error corrections, consider that the transfer function of an ideal ADC can be described by the straight line equation.\n\n$$y = mx + c \\tag{2}$$\n\nThis equation can be applied to the ADC transfer function where: *y* is the corrected ADC result. *m* is the gain or slope of the line. *x* is the uncorrected ADC result. *c* is the offset.\n\nThe gain or slop of the line can be described as follows:\n\n$$m = (y2 - y1)/(x2 - x1)$$\n\nwhere the following are in volts:\n\ny2 is the input voltage at close to the positive full-scale input. y1 is the input voltage at close to the negative full-scale input. x2 is the converted voltage with the y2 voltage applied at the input. x1 is the converted voltage with the y1 voltage applied at the input.\n\nThe ideal slope or gain is m = 1V/V.\n\nThe system error correction coefficients in the Offset Error Correction and Gain Error Correction sections detail how signal chain errors in offset (c) and gain (m) can be', '# <span id=""page-26-0""></span>**APPLICATIONS INFORMATION**\n\n#### **TYPICAL APPLICATIONS DIAGRAMS**\n\n![](_page_26_Figure_3.jpeg)\n\n*Figure 44. AD4086 Typical Applications Diagram, Fully Differential Amplifier*\n\n![](_page_26_Figure_5.jpeg)\n\n*Figure 45. AD4086 Typical Applications Diagram, Single Op-Amp Drivers*\n\n**[analog.com](http://www.analog.com/en/index.html) Rev. 0 | 27 of 91**']","En el AD4086, los pines **B4 y B5** corresponden a las señales **DCO− y DCO+** (respectivamente) y su funcionalidad es actuar como salidas de reloj de eco LVDS (**LVDS Echo Clock Outputs**) [ID: P-71c8104c].","Los pines B4 y B5 corresponden a DCO- y DCO+, y funcionan como salidas de reloj de eco LVDS (LVDS Echo Clock Outputs) en el dominio de alimentación IOVDD.",1.0,0.9814455404167802,0.9999999999,0.0
¿Cuál es el rango de voltaje aceptable para la entrada del regulador LDO (pin VDDLDO) en el AD4086?,"['|                               |            |       | When power is supplied to VDDLDO (B3), an internal LDO voltage regulator produces<br>the 1.1V required at this pin. [...] |                               |            |       | If VDDLDO is left disconnected, the required 1.1V must be supplied to this pin from an<br>external source (typically the host controller interface supply).', '# **EXTERNALLY GENERATED SUPPLY CONFIGURATION**\n\nIn system using externally generated supplies VDDLDO must be left unconnected. With VDDLDO unconnected both the internal LDO powering VDD11 and the internal LDO powering IOVDDD are automatically disabled. VDD11 must be connected to an externally generated 1.1V supply rail, and IOVDD should be connected to an externally generated 1.1V to 1.2V supply rail. It should be noted that if VDD11 is not present, the device will be held in a power-on reset (POR) state, and all AD4086 registers reset to their default state after the supply has been reestablished. More details on the POR circuitry can be found in the Power-On Reset (POR) Monitor section. The VDD33 rail is supplied with an external 3.3V supply. The VDD33 supply can be removed to further reduce power (see the [Power Saving Operating Modes](#page-23-0) section), only analog circuity is held in reset, and the register content remains unaffected. Refer to [Table 1](#page-2-0) for the applicable input voltage tolerance for each supply rail.\n\nAs illustrated in the example of Figure 38, external voltage sources are applied to VDD11 and IOVDD pins.\n\n![](_page_21_Figure_16.jpeg)\n\n*Figure 38. Externally Sourced Supply Configuration*\n\n#### **POWER-ON RESET (POR) MONITOR**\n\nThe AD4086 power supply monitoring circuits inhibit the converter functions and reset the configuration memory when supply conditions are outside the specified operating limits. This function ensures each device is', '| VDDLDO                | VDD11 LDO disabled                          |       | 0    | 0.02  | mA   |  | [...] | VDDLDO                | VDD11 LDO enabled                           |       | 1.7  | 4.8   | mA   |  | [...] | VDDLDO                | VDD11 LDO disabled                          |       | 0    | 0.02  | mA   |  | [...] | VDDLDO                | VDD11 LDO enabled                           |       | 1.4  | 4.5   | mA   |  | [...] | Static                | VDD11 LDO', '| VDDLDO                | VDD11 LDO enabled                           |       | 21.5 | 26.5  | mA   |  | [...] | VDDLDO                | VDD11 LDO disabled                          |       | 0    | 0.02  | mA   |  | [...] | VDDLDO                | VDD11 LDO enabled                           |       | 30.9 | 36.8  | mA   |  | [...] | VDDLDO                | VDD11 LDO disabled                          |       | 0    | 0.02  | mA   |  | [...] | VDDLDO                | VDD11 LDO enabled                           |       | 31   | 37    | mA   |  |', '| VDDLDO                |                                             | 1.4   |      | 2.7   | V    |  | [...] | VDDLDO                | VDD11 LDO disabled                          |       | 0    | 0.02  | mA   |  | [...] | VDDLDO                | VDD11 LDO enabled                           |', '# **ESD Ratings for the AD4086**\n\n*Table 5. AD4086, 49-Ball CSP\\_BGA*\n\n| ESD Model                                                                                   | Withstand Threshold (V) | Class |\n|---------------------------------------------------------------------------------------------|-------------------------|-------|\n| HBM (Pin E1, Pin E2, Pin D1, and Pin<br>D2 (IN−, AUXIN−, IN+, and AUXIN+,<br>respectively)) | 1000                    | 1C    |\n| HBM (All other pins)                                                                        | 1500                    | 1C    |\n| FICDM                                                                                       | 750                     | C2b   |\n\n#### **ESD CAUTION**\n\n![](_page_7_Picture_20.jpeg)\n\n**ESD (electrostatic discharge) sensitive device**. Charged devices and circuit boards can discharge without detection. Although this product features patented or proprietary protection circuitry, damage may occur on devices subjected to high energy ESD. Therefore, proper ESD precautions should be taken to avoid performance degradation or loss of functionality.\n\n**[analog.com](http://www.analog.com/en/index.html) Rev. 0 | 8 of 91**']",El rango de voltaje aceptable para la entrada del regulador LDO (pin VDDLDO) en el AD4086 es de 1.4 V a 2.7 V [ID: P-732f3e39].,El rango de voltaje aceptable de entrada para la patilla LDO (VDDLDO) está entre 1.4 V y 2.7 V.,1.0,1.0000000000000002,0.19999999998,1.0
¿Qué valor nominal de capacitancia de desacoplo interno se incorpora para los pines de alimentación del núcleo VDD11?,"['# **DIGITAL FEATURES**', '# **DIGITAL FEATURES**', '# **DIGITAL FEATURES**', '|                                                                                                                                                                                                                                                                                                                                                                |\n\n**[analog.com](http://www.analog.com/en/index.html) Rev. 0 | 54 of 91**', '# **SPECIFICATIONS**\n\n*Table 1. Specifications (Continued)*\n\n| Parameter             | Test Conditions/Comments                    | Min   | Typ  | Max   | Unit |  |\n|-----------------------|---------------------------------------------|-------|------|-------|------|--|\n| POWER SUPPLIES        |                                             |       |      |       |      |  |\n| VDD33                 |                                             | 3.135 | 3.30 | 3.465 | V    |  |\n| VDDLDO                |                                             | 1.4   |      | 2.7   | V    |  |\n| VDD11                 | Applied externally, LDO disabled            | 1.045 | 1.10 | 1.155 | V    |  |\n| IOVDD                 | Applied externally, LDO disabled            | 1.045 | 1.10 | 1.26  | V    |  |\n| Operating Current     | LVDS_CNV_EN = 0                             |       |      |       |      |  |\n| Static                | Converter and interface idle, FIFO disabled |       |      |       |      |  |\n| VDD33                 |                                             |       | 5.72 | 7.14  | mA   |  |\n| VDDLDO                | VDD11 LDO disabled                          |       | 0    | 0.02  | mA   |  |\n| VDD11                 |                                             |       | 16.4 | 23    | mA   |  |\n| IOVDD                 |                                             |       | 5.43 | 6     | mA   |  |\n| VDDLDO                | VDD11 LDO enabled                           |', '|       | 5.43 | 6     | mA   |  |\n| VDDLDO                | VDD11 LDO enabled                           |       | 21.5 | 26.5  | mA   |  |\n| Dynamic               | DC input signal                             |       |      |       |      |  |\n| VDD33                 |                                             |       | 16.4 | 18.72 | mA   |  |\n| VDDLDO                | VDD11 LDO disabled                          |       | 0    | 0.02  | mA   |  |\n| VDD11                 |                                             |       | 24.5 | 30.8  | mA   |  |\n| IOVDD                 |                                             |       | 8.3  | 9.3   | mA   |  |\n| VDDLDO                | VDD11 LDO enabled                           |       | 30.9 | 36.8  | mA   |  |\n| Dynamic               | −0.5dBFS sine-wave input signal             |       |      |       |      |  |\n| VDD33                 |                                             |       | 14.7 | 16.2  | mA   |  |\n| VDDLDO                | VDD11 LDO disabled                          |       | 0    | 0.02  | mA   |  |\n| VDD11                 |                                             |       | 24.5 | 31    | mA   |  |\n| IOVDD                 |                                             |       | 8.7  | 9.8   | mA   |  |\n| VDDLDO                | VDD11 LDO enabled                           |       | 31   | 37    | mA   |  |\n| Standby Mode          | LVDS_SELF_CLK_MODE disabled']",INFORMACIÓN NO DISPONIBLE EN EL CORPUS DE SEGURIDAD,Los pines de alimentación del núcleo VDD11 están desacoplados internamente mediante cuatro condensadores de 470 nF a GND.,1.0,0.0,0.0,0.0
¿Cuál es el ancho de banda a -3dB especificado para las entradas analógicas del AD4086 sin filtro externo?,"['The AD4086 integrates a charge reservoir capacitor (CREF) and a low-drift reference buffer at the reference input pin (REFIN), eliminating the need for dedicated external components and enabling multiple AD4086 devices to share a single voltage reference.', '.analog.com/en/index.html) Rev. 0 | 71 of 91**', '# <span id=""page-59-0""></span>**DIGITAL FEATURES**\n\n#### **DIGITAL FILTER**\n\nThe AD4086 includes the option of enabling an integrated digital filter for applications where noise rejection by bandwidth limiting is desired. As shown in Figure 91 and detailed as follows, there are four paths available by which to route digital data: no digital filtering, a sinc1 filter, a sinc5 filter, or a sinc5 compensated filter.\n\nFurther details on each of these filters is described in the following sections. To ensure the first filter result produces the correct data, when a user makes a change to the filter selection, a reset must be issued via the GPIO pin configured for filter synchronization (FILTER\\_SYNC).\n\n![](_page_59_Figure_5.jpeg)\n\n*Figure 91. Digital Filter Selection Options*\n\n#### **Benefits of Digital Filtering**\n\nThe ADC result path can be configured to use the integrated digital filter feature. The filter configuration register (see the [Filter Configu](#page-89-0)[ration Register](#page-89-0) section, Address 0x29) contains the FILTER\\_SEL bits that allow the user to bypass (default register setting) the digital filter or select from one of three filter options. Each filter has unique bandwidth profile properties that allows high flexibility in allowing selection to be made depending on the end application requirements. Table 28 shows the −3dB bandwidths achievable for each user-selectable filter type. The SINC\\_DEC\\_RATE bits controls the bandwidth and the data decimation', 'al input, DI/O is digital input and output, DO is digital output, and P is power.\n\n**[analog.com](http://www.analog.com/en/index.html) Rev. 0 | 11 of 91**\n\n#### <span id=""page-11-0""></span>**TYPICAL PERFORMANCE CHARACTERISTICS**\n\n![](_page_11_Figure_2.jpeg)\n\n*Figure 3. Fast Fourier Transform (FFT) 40MSPS, fIN = 1kHz, −0.5dBFS*\n\n![](_page_11_Figure_4.jpeg)\n\n*Figure 4. FFT 40MSPS, fIN = 1MHz, −1.0dBFS*\n\n![](_page_11_Figure_6.jpeg)\n\n*Figure 5. SNR vs. Input Signal Frequency (Amplitude = −0.5dBFS, −1dBFS, −3dBFS, −6dBFS, −10dBFS, and −12dBFS)*\n\n![](_page_11_Figure_8.jpeg)\n\n*Figure 6. THD vs. Input Signal Frequency (Amplitude = −0.5dBFS, −1dBFS, −3dBFS, −6dBFS, −10dBFS, and −12dBFS)*\n\n![](_page_11_Figure_10.jpeg)\n\n*Figure 7. Small Signal −3dB Bandwidth at 40MSPS*\n\n![](_page_11_Figure_12.jpeg)\n\n*Figure 8. Sinc5 + Compensation Filter, Pass-Band Flatness*\n\n**[analog.com](http://www.analog.com/en/index.html) Rev. 0 | 12 of 91**\n\n#### **TYPICAL PERFORMANCE CHARACTERISTICS**\n\n![](_page_12_Figure_2.jpeg)\n\n*Figure 9. Sinc1 Filter Response, f<sup>S</sup> = 40MHz (DEC × Means Decimate By)*\n\n![](_page_12_Figure_4.jpeg)\n\n*Figure 10. Sinc5 Filter Response, f<sup>S</sup> = 40MHz*\n\n![](_page_12_Figure_6.jpeg)\n\n*Figure 11. Sinc5 + Compensation Filter Response, f<sup>S</sup> = 40MHz*\n\n![](_page_12_Figure_8.jpeg)\n\n*Figure 12. SNR vs. Total Decimation Factor*\n\n![](_page_12_Figure_10.jpeg)\n\n*Figure 13. DNL vs. Code for Various Temperatures, 40MSPS*\n\n![](_page_12_Figure_12.jpeg)\n\n*Figure 14. INL vs.', 'l)\n\n#### **ORDERING GUIDE**\n\n| Model1         | Temperature Range | Package Description                                  | Packing Quantity | Package Option |\n|----------------|-------------------|------------------------------------------------------|------------------|----------------|\n| AD4086BBCZ     | −40°C to +85°C    | 49-Ball Chip Scale Package Ball Grid Array (CSP_BGA) | Tray, 490        | BC-49-8        |\n| AD4086BBCZ-RL  | −40°C to +85°C    | 49-Ball Chip Scale Package Ball Grid Array (CSP_BGA) | Reel, 4000       | BC-49-8        |\n| AD4086BBCZ-RL7 | −40°C to +85°C    | 49-Ball Chip Scale Package Ball Grid Array (CSP_BGA) | Reel, 1000       | BC-49-8        |\n\n<sup>1</sup> Z = RoHS Compliant Part.\n\n#### **Legal Terms and Conditions**\n\nInformation furnished by Analog Devices is believed to be accurate and reliable ""as is"". However, no responsibility is assumed by Analog Devices for its use, nor for any infringements of patents or other rights of third parties that may result from its use. Specifications subject to change without notice. No license is granted by implication or otherwise under any patent or patent rights of Analog Devices. Trademarks and registered trademarks are the property of their respective owners. All Analog Devices products contained herein are subject to release and availability.\n\n**[analog.com](http://www.analog.com/en/index.html) Rev. 0 | 91 of 91**', '### **POWER SAVING OPERATING MODES**\n\nThe operating mode of the AD4086 is controlled by the OPERAT-ING\\_MODES bits in the device configuration register (see the [De](#page-71-0)[vice Configuration Register](#page-71-0) section, Address (0x02)). On power-up and after reset, the default is normal mode (OPERATING\\_MODES = 00). [Table 11](#page-24-0) describes all operating modes, and Figure 42 depicts the allowed transitions between these modes. Note that direct transitions between the two power saving modes (standby mode and sleep mode) are not permitted.\n\nIt is important to stop all conversion and data interface clocking before configuring the power mode.\n\nWhen in either standby mode or sleep mode, the VDD33 supply can be removed to reduce power consumption. This supply must be re-established prior to issuing the SPI configuration interface command to exit either power saving mode.\n\n![](_page_23_Picture_11.jpeg)\n\n*Figure 42. Operating Mode Transitions*\n\nTransitioning from normal mode to either of the two power saving modes is achieved by writing the required value to the OPERAT-ING\\_MODES bits in the device configuration register (see the [Device Configuration Register](#page-71-0) section). Waking up (that is, transi-\n\n**[analog.com](http://www.analog.com/en/index.html) Rev. 0 | 24 of 91**']",INFORMACIÓN NO DISPONIBLE EN EL CORPUS DE SEGURIDAD,El ancho de banda analógico a -3dB sin usar filtros externos es de 272 MHz.,1.0,0.0,0.0,0.0
¿Qué rango de temperatura de funcionamiento soporta la extrusora del Proyecto Helios?,"['received data and retry the data read in a new SPI frame. Clear the CRC\\_ERR flag before any attempt to initiate a repeated read or write to the configuration memory to allow detection of any subsequent errors. The error flag is cleared by writing code 0x08 to the Interface Status A register to set the CRC\\_ERR bit to a Logic 1. It is recommended that an immediate read of the Interface Status A register follows any attempt to clear the fault to validate the attempt was successful.\n\nThe configuration CRC function is disabled by default and can be enabled through two complementary bit fields, CRC\\_ENABLE and CRC\\_ENABLEB, in the Interface Configuration C register (see the [Interface Configuration C Register](#page-76-0) section, Address 0x10). To enable the CRC function, set the CRC\\_ENABLE bits to 1 and the CRC\\_ENABLEB bits to 10. Each of the complementary CRC bit fields is 2-bit wide, and any combination other than that specified results in the function remaining disabled. It is important to note that once the CRC function is enabled, a valid checksum from the host controller is required for all subsequent serial transactions according to the conditions described in [Table 18.](#page-40-0) If used, enable and validate the CRC function before writing to any of the device configuration registers. To validate the CRC function is enabled, follow the CRC configuration write with a SPI frame consisting of a read of both the Interface Configuration C register and the', '# **Reference Voltage Buffer Temperature Coefficient**\n\n[Remove this section]\n\n#### **Aperture Delay**\n\n[Please remove this section]\n\n#### **Transient Response**\n\n[Please remove section]\n\n#### **Signal-to-Noise Ratio (SNR)**\n\nSNR is the computed ratio of the fundamental signal amplitude measured in RMS volts and the root sum of squares of all other spectral components in the Nyquist bandwidth (f < fS/2) excluding harmonics and DC components. The computed value of SNR is converted into a logarithmic scale and expressed in decibels (dB).\n\n#### **Signal-to-Noise-and-Distortion (SINAD) Ratio**\n\nSINAD is the computed ratio of the fundamental signal amplitude measured in RMS volts and the root sum of squares of all other spectral components in the Nyquist bandwidth (f < fS/2) including harmonic components but excluding the DC component. The computed value of SINAD is converted into a logarithmic scale and expressed in decibels (dB).\n\n#### **Total Harmonic Distortion (THD)**\n\nTHD is the ratio of the RMS sum of the amplitudes of the first five harmonic components to the RMS amplitude of a full-scale input signal expressed in decibels (dB).', 'ral\n\nconfiguration register (Address 0x1C) to allow HI\\_DTCT and LO\\_DTCT to propagate to the ALERT signal. Any enabled GPIO set to output a status alert, that is, with GPIO\\_x\\_SEL set to 0b0110, routes the ALERT signal to the GPIO to indicate when an event occurs. A GPIO configured in this mode is normally high, with a logic low indicating that an event has occurred. As indicated in the [Figure 79](#page-52-0) section, this GPIO remains low only while the threshold level is crossed, and it returns to logic high as soon as the threshold bound is no longer crossed, and the timing in Figure 78 is satisfied.\n\nEvent detection is synchronous to the rising edge of the CNV+. A latency of two conversion clock cycles exists from the first CNV+ edge where the analog input crosses a threshold to a detected event that is flagged in the device status register and to any GPIO configured to route ALERT. As is evident in [Figure 77,](#page-50-0) where both the HI\\_DTCT flag and ALERT routed to a GPIO are shown, the behavior, once the threshold level is no longer crossed, is different. When a CNV+ rising edge occurs where the analog input no longer crosses the set threshold, ALERT de-asserts two conversion cycles later, on the rising edge of CNV. Any HI\\_DTCT or LO\\_DTCT already set is not cleared at this point. These signals are only cleared by writing 1 to the relevant bits in the device status register (Address 0x14) or where a device reset occurred.\n\n![](_page_51_Figure_9.jpeg)\n\n*Figure', '# **TYPICAL PERFORMANCE CHARACTERISTICS**\n\n![](_page_13_Figure_2.jpeg)\n\n*Figure 15. Low Frequency Noise, Inputs Shorted*\n\n![](_page_13_Figure_4.jpeg)\n\n*Figure 16. Histogram of Codes, Sinc1, No Filter, Decimate 2×, Decimate 4× … Decimate 1024×*\n\n![](_page_13_Figure_6.jpeg)\n\n*Figure 17. Histogram of Codes, Sinc5, No Filter, Decimate 2×, Decimate 4× ...Decimate 256×*\n\n![](_page_13_Figure_8.jpeg)\n\n*Figure 18. Histogram of Codes, Sinc5 + Compensation, No Filter, Decimate 2×, Decimate 4× … Decimate 512×*\n\n![](_page_13_Figure_10.jpeg)\n\n*Figure 19. Offset Voltage Histogram*\n\n![](_page_13_Figure_12.jpeg)\n\n*Figure 20. Offset Drift vs. Temperature*\n\n**[analog.com](http://www.analog.com/en/index.html) Rev. 0 | 14 of 91**\n\n#### <span id=""page-14-0""></span>**TYPICAL PERFORMANCE CHARACTERISTICS**\n\n![](_page_14_Figure_2.jpeg)\n\n*Figure 21. Gain Error vs. Temperature*\n\n![](_page_14_Figure_4.jpeg)\n\n*Figure 22. PSRR vs. Frequency*\n\n![](_page_14_Figure_6.jpeg)\n\n*Figure 23. CMO Voltage vs. Temperature*\n\n![](_page_14_Figure_8.jpeg)\n\n*Figure 24. CMO Voltage Variation vs. Load Resistance*\n\n![](_page_14_Figure_10.jpeg)\n\n*Figure 25. Dynamic REFIN Current vs. Temperature*\n\n![](_page_14_Figure_12.jpeg)\n\n*Figure 26. Total Power vs. Sampling Frequency*\n\n**[analog.com](http://www.analog.com/en/index.html) Rev. 0 | 15 of 91**', '# <span id=""page-24-0""></span>**THEORY OF OPERATION**\n\ntioning back to normal mode) is achieved in a similar way, because the SPI configuration interface operation is not affected by any of the power saving modes (see the [SPI Configuration Interface](#page-31-0) section). Standby mode can be selected to save power in the case where the user wants to quickly return to normal conversions. Sleep mode is a lower power state where returning to normal mode takes longer. Both standby and sleep mode can be particularly useful when used with the result FIFO (see the [Result FIFO](#page-52-0) section), whereby previously stored conversion data can be accessed from the FIFO while it is still in the selected power saving mode.\n\nTo reduce power consumption in both standby and sleep modes, the internal IOVDD LDO regulator is powered down. If the user is not externally supplying IOVDD, all IOVDD domain inputs and outputs are disabled (all GPIOx, all LVDS data interface (see the [LVDS Data Interface](#page-41-0) section), and SPI data interface (see the [SPI Data Interface](#page-47-0) section) signals are disabled. In this specific condition, it is still possible to write to the AD4086 SPI configuration to issue a command to return to normal mode by writing to the OPERATING\\_MODES bits in the device configuration register (see the [Device Configuration Register](#page-71-0) section) or to issue a software reset (see the [Software Reset](#page-25-0) section). As GPIOx is disabled, it is']",INFORMACIÓN NO DISPONIBLE EN EL CORPUS DE SEGURIDAD,INFORMACIÓN NO DISPONIBLE EN EL CORPUS DE SEGURIDAD,0.0,0.0,0.0,1.0
¿Cuál es el límite absoluto de torque admisible para el acople de la extrusora Line-3 en el manual V2?,"['| [...] |                                 |            |       | source within their allowed specification limits. [...] |', '0 | 3 of 91**', '*Table 1. [...] | VDD33                 |                                             | 3.135 | 3.30 | 3.465 | V    |  | [...] | VDDLDO                |                                             | 1.4   |      | 2.7   | V    |  | [...] | VDD33                 |                                             |       | 5.72 | 7.14  | mA   |  | [...] | VDD11                 |                                             |       | 16.4 | 23    | mA   |  |', '|', '|        | [...] |                                                                         | LVDS_VOD = 100b']",INFORMACIÓN NO DISPONIBLE EN EL CORPUS DE SEGURIDAD,INFORMACIÓN NO DISPONIBLE EN EL CORPUS DE SEGURIDAD,0.0,0.0,0.0,1.0
